Judul,Konsentrasi
ANALISA DAN PERANCANGAN SISTEM INFORMASI PENDAFTARAN GUGATAN SEDERHANA ONLINE DI PENGADILAN NEGERI TONDANO,RPL
ANALISA QUALITY OF SERVICE ( QOS ) PADA JARINGAN KOMPUTER DI SMK KRISTEN 1 TOMOHON,TKJ
Analisis dan Desain Jaringan Internet di SMP Negeri 2 Tahuna,TKJ
ANALISIS DAN PERANCANGAN JARINGAN DI SMA NEGERI 1 ESSANG,TKJ
Analisis Dan Perancangan Jaringan Di SMK Kristen 3 Tomohon,TKJ
ANALISIS DAN PERANCANGAN JARINGAN KOMPUTER DI DINAS KOMUNIKASI DAN INFORMATIKA KABUPATEN MINAHASA,TKJ
ANALISIS DAN PERANCANGAN JARINGAN KOMPUTER DI SEKOLAH MENENGAH ATAS,TKJ
ANALISIS DAN PERANCANGAN JARINGAN KOMPUTER DI SEKOLAH MENENGAH PERTAMA,TKJ
Analisis Dan Perancangan Jaringan Komputer Di SMA Kosgoro Tomohon,TKJ
ANALISIS DAN PERANCANGAN JARINGAN KOMPUTER DI SMK,TKJ
ANALISIS DAN PERANCANGAN JARINGAN KOMPUTER DI SMK NEGERI 1 LANGOWAN MENGGUNAKAN TEKNOLOGI NIRKABEL,TKJ
ANALISIS DAN PERANCANGAN JARINGAN KOMPUTER DI SMK NEGERI 1 RANOYAPO,TKJ
Analisis Dan Perancangan Jaringan Komputer Di SMP Negeri 1 Tondano,TKJ
ANALISIS DAN PERANCANGAN JARINGAN KOMPUTER PADA KANTOR BUPATI HAMAHERA BARAT,TKJ
ANALISIS DAN PERANCANGAN JARINGAN LAN DI SMP NEGERI 1 TONDANO,TKJ
ANALISIS DAN PERANCANGAN JARINGAN LAN DI SMP NEGERI 3 TONDANO,TKJ
ANALISIS DAN PERANCANGAN JARINGAN WIRELESS LAN SMP KATOLIK ST. FRANSISKUS DE SALLES KOKOLEH,TKJ
Analisis dan Perancangan jaringan Wireless Local Area Network di SMK Negeri 1 Mopuya,TKJ
Analisis dan perancangan jaringan wireless local area network di SMKS Kristen 2 Tomohon,TKJ
ANALISIS DAN PERANCANGAN JARINGAN WIRELESS LOCAL AREA NETWORK DI SMP NEGERI 1 KAKAS,TKJ
ANALISIS DAN PERANCANGAN PERKEMBANGAN PESERTA DIDIK BERBASIS SMS GATEWAY DI SMA NEGERI 2 TAHUNA,RPL
ANALISIS DAN PERANCANGAN SISTEM INFORMASI AKADEMIK BERBASIS WEB DI SMA NEGERI 3 TONDANO,RPL
ANALISIS DAN PERANCANGAN SISTEM INFORMASI PEMESANAN TIKET KAPAL LAUT DI PT. PELAYARAN TERATAI MURNI LINES MANADO,RPL
ANALISIS DAN PERANCANGAN SISTEM INFORMASI PENILAIAN PRESTASI KERJA DOSEN BERBASIS WEB DI FAKULTAS TEKNIK UNIVERSITAS NEGERI MANADO,RPL
ANALISIS DAN PERANCANGAN SISTEM INFORMASI PERPUSTAKAAN BERBASIS WEB DI SMA NEGERI 1 TONDANO,RPL
ANALISIS DAN PERANCANGAN SISTEM INFORMASI SMP NEGERI IV LIRUNG DI KALONGAN,RPL
ANALISIS DAN PERANCANGAN SISTEM PAKAR DIAGNOSA KERUSAKAN LAPTOP BERBASIS MOBILE,TKJ
ANALISIS DAN PERANCANGAN SISTEM PENDAFTARAN SISWA BARU BERBASIS WEB DI SMK MUHAMMADIYAH KOTA BITUNG,RPL
Analisis dan Perancangan Sistem Pendaftaran Siswa Baru Berbasis Web di SMK Muhammadiyah Kota Bitung,RPL
ANALISIS DAN PERANCANGAN SISTEM PENDUKUNG KEPUTUSAN PEMILIHAN JURUSAN MENGGUNAKAN METODE WEIGHT PRODUCT,RPL
ANALISIS DAN PERANCANGAN SISTEM PENJADWALAN MENGGUNAKAN ALGORITMA GENETIKA,RPL
ANALISIS DAN PERANCANGAN SISTEM REGISTRASI ONLINE PADA SMA NEGERI 3 TONDANO,RPL
ANALISIS FAKTOR- FAKTOR YANG MEMPENGARUHI KESULITAN BELAJAR PADA MATA PELAJARAN TEKNOLOGI INFORMASI DAN KOMUNIKASI DI SMA NEGERI 1 KABAWO,Undefined
Analisis Keaktifan Belajar Siswa SMK Selama masa Pandemi Covid-19,Undefined
Analisis Kendala dan Alternatif Pembelajaran Daring pada masa Pandemi Covid-19,Undefined
ANALISIS KESIAPAN SISWA TERHADAP PENERAPAN BLENDED LEARNING DI SMK NEGERI 1 TONDANO,Undefined
ANALISIS KUALITAS LAYANAN JARINGAN INTERNET DI AKADEMI KEPERAWATAN BETHESDA TOMOHON,TKJ
Analisis Kualitas Layanan Pada Jaringan Wireless LAN Di SMK Negeri 1 Tondano,TKJ
ANALISIS PELAYANAN JARINGAN INTERNET DI KEPULAUAN KARAKELANG,TKJ
ANALISIS PEMBELAJARAN DARING PADA SMK,Undefined
ANALISIS PEMBELAJARAN JARINGAN DASAR DI SEKOLAH MENENGAH KEJURUAN,TKJ
ANALISIS QUALITY OF SERVICE (QOS) JARINGAN WI-FI DI SMK YADIKA LANGOWAN,TKJ
ANALISIS QUALITY OF SERVICE (QoS) PADA JARINGAN KOMPUTER DI SMK NEGERI 1 KAKAS,TKJ
ANALISIS QUALITY OF SERVICE (QOS) PADA LAYANAN JARINGAN INTERNET DI SMK NEGERI 2 TONDANO,TKJ
ANALISIS QUALITY OF SERVICE PADA JARINGAN KOMPUTER DI SMK 23 MARET KOTAMOBAGU,TKJ
ANALISIS TINGKAT KESIAPAN SEKOLAH TERHADAP PENERAPAN E-LEARNING DI SMK,Undefined
APLIKASI MULTIMEDIA PEMBELAJARAN PROYEK IPAS DI SMK KRISTEN 3 TOMOHON,Multimedia
APLIKASI TAKSONOMI ORGANISME BERBASIS MOBILE,RPL
Audit Sistem Informasi Rumah Sakit Menggunakan Framework COBIT 5.0 di Rumah Sakit Hermana Lembean,RPL
BEST PRACTICE FOTOGRAFI PORTRAIT MENGGUNAKAN SMARTPHONE PADA KONDISI PENCAHAYAAN SOFT LIGHT,Multimedia
BEST PRACTICE FOTOGRAFI SAND AND SEA MENGGUNAKAN KAMERA MIRRORLESS DENGAN PENCAHAYAAN HARD LIGHT,Multimedia
BEST PRACTICE MOUNTAIN AND LANDSCAPE FOTOGRAFI MENGGUNAKAN KAMERA DSLR PADA KONDISI PENCAHAYAAN HARD LIGHT,Multimedia
DESAIN DAN IMPLEMENTASI SISTEM INFORMASI RAPOR BERBASIS WEB,RPL
DIGITASI PENYEBARAN MAHASISWA UNIVERSITAS NEGERI MANADO,RPL
EFEKTIVITAS PEMBELAJARAN JARAK JAUH UNTUK MENINGKATKAN HASIL BELAJAR JARINGAN DASAR SISWA KELAS X TKJ SMK NEGERI 1 MODOINDING,TKJ
Evaluasi Kebergunaan (Usability) Dan Rekomendasi Penggunaan Learning Management System Menggunakan Metode Use Di Universitas Negeri Manado,RPL
FILM DOKUMENTER SEJARAH KAMPUNG KAMASI DENGAN MENGGUNAKAN TEKNIK CINEMA VARITE,Multimedia
GAME EDUKASI PEMBELAJARAN LAGU NASIONAL DAN DAERAH,Multimedia
GAME EDUKASI UNTUK PENDIDIKAN TAMAN KANAK - KANAK,Multimedia
GAME PEMBELAJARAN BAHASA INGGRIS BERBASIS MOBILE DI SMK,RPL
HASIL BELAJAR DESAIN GRAFIS PERCETAKAN MENGGUNAKAN MODEL PEMBELAJARAN PROJECT BASED LEARNING DENGAN MEDIA TPACK SISWA KELAS XI PROGRAM MULTIMEDIA DI SMK COKROAMINOTO KOTAMOBAGU,Multimedia
HUBUNGAN ANTARA KECERDASAN EMOSIONAL DAN KEMANDIRIAN BELAJAR DENGAN HASIL BELAJAR SISWA KELAS X SMK DHARMA BHAKTI TOMOHON,Undefined
HUBUNGAN ANTARA MINAT DAN PRESTASI BELAJAR SISWA TKJ SMK NEGERI 1 BITUNG,Undefined
"HUBUNGAN ANTARA MINAT, KREATIFITAS DAN HASIL BELAJAR TKJ SISWA KELAS X SMK KRISTEN 1 TOMOHON.",TKJ
"HUBUNGAN ANTARA MINAT, MOTIVASI DAN PRESTASI BELAJAR TIK SISWA SMA PGRI POIGAR",Undefined
HUBUNGAN ANTARA MOTIVASI BERPRESTASI DENGAN HASIL BELAJAR SISTEM KOMPUTER SISWA KELAS X TKJ SMK NEGERI 1 LANGOWAN,TKJ
"HUBUNGAN ANTARA PEMANFAATAN INTERNET, MOTIVASI DAN PRESTASI BELAJAR SISWA SMK KRISTEN KAWANGKOAN",Undefined
HUBUNGAN ANTARA PERSEPSI SISWA TENTANG PEMANFAATAN FASILITAS LAB DAN MOTIVASI DENGAN PRESTASI BELAJAR SISWA SMK ANUGRAH TONDANO,Multimedia
HUBUNGAN ANTARA SIKAP DAN HASIL BELAJAR SISWA SMP SANTA ROSA DELIMA TONDANO,Undefined
"HUBUNGAN ANTARA SIKAP MENGAJAR GURU, MOTIVASI BERPRESTASI DAN HASIL BELAJAR MULTIMEDIA SISWA SMK NEGERI 1 TOMPASOBARU",Multimedia
"HUBUNGAN ANTARA STATUS SOSIAL EKONOMI, MOTIVASI DAN HASIL BELAJAR SIMULASI DAN KOMUNIKASI DIGITAL SISWA KELAS X SMK NEGERI 1 TONDANO",Multimedia
HUBUNGAN CARA BELAJAR DAN MOTIVASI DENGAN PRESTASI BELAJAR TIK SISWA SMA NEGERI 1 WORI,Undefined
HUBUNGAN DISIPLIN BELAJAR DAN KEMANDIRIAN DENGAN PRESTASI BELAJAR SISWA KELAS XI SMK 1 SINONSAYANG,Undefined
HUBUNGAN DISIPLIN BELAJAR DAN KREATIFITAS BELAJAR DENGAN HASIL BELAJAR SISWA TIK SMP NEGERI 1 TUMPAAN,Undefined
HUBUNGAN DISIPLIN DAN MINAT DENGAN HASIL BELAJAR TIK SISWA KELAS XI SMA NEGERI 2 LANGOWAN,Undefined
HUBUNGAN DISIPLIN DAN MOTIVASI DENGAN HASIL BELAJAR TIK SISWA SMA N 1 WORI,Undefined
Hubungan Displin Dan Motivasi Berprestasi Dengan Hasil Belajar KKPI Siswa SMK Negeri 1 Tondano,TKJ
HUBUNGAN FASILITAS BELAJAR DAN CARA BELAJAR DENGAN HASIL BELAJAR SISWA MULTIMEDIA SMK NEGERI 2 MANADO,Multimedia
HUBUNGAN FASILITAS BELAJAR DAN MINAT TERHADAP HASIL BELAJAR TIK SISWA SMA KRISTEN SONDER,Undefined
HUBUNGAN FASILITAS DAN MINAT DENGAN HASIL BELAJAR TEKNIK KOMPUTER SISWA SMK NEGERI 3 TONDANO,TKJ
HUBUNGAN GAYA BELAJAR DAN KREATIVITAS DENGAN KEBIASAAN BELAJAR TEKNOLOGI INFORMASI DAN KOMUNIKASI DI SMA NEGERI 1 KUMELEMBUAI,Undefined
HUBUNGAN GAYA BELAJAR DAN MINAT DENGAN HASIL BELAJAR TIK SISWA KELAS XII SMA NEGERI 1 KAWANGKOAN,Undefined
HUBUNGAN KEBIASAAN BELAJAR DAN MOTIVASI BERPRESTASI TERHADAP HASIL BELAJAR TIK SISWA VII SMP NEGERI 1 TONDANO,Undefined
HUBUNGAN KECERDASAN EMOSIONAL DAN MOTIVASI BERPRESTASI DENGAN HASIL BELAJAR KKPI SISWA SMK NUSANTARA TONDANO,TKJ
HUBUNGAN KECERDASAN SOSIAL DAN KEMANDIRIAN BELAJAR DENGAN PRESTASI BELAJAR SISWA MULTIMEDIA SMK NEGERI 1 TONDANO,Multimedia
HUBUNGAN KEMANDIRIAN DAN MOTIVASI DENGAN HASIL BELAJAR KKPI SISWA KELAS X ADP SMK NEGERI 1 SINONSAYANG,TKJ
HUBUNGAN KEMANDIRIRAN BELAJAR DENGAN PRESTASI BELAJAR SISWA TKJ DI SMA YADIKA LANGOWAN,TKJ
HUBUNGAN KEPRIBADIAN GURU DAN MOTIVASI BELAJAR SISWA DENGAN HASIL BELAJAR MATA PELAJARAN PRODUKTIF MULTIMEDIA SMK NEGERI 1 TONDANO,Multimedia
"HUBUNGAN KESIAPAN BELAJAR, MOTIVASI BERPRESTASI DAN HASIL BELAJAR KKPI SISWA SMK NUSANTARA TONDANO",TKJ
HUBUNGAN KETERAMPILAN MENGAJAR GURU TERHADAP HASIL BELAJAR MATA PELAJARAN TIK SISWA KELAS VIII SMP NEGERI 1 SONDER,Undefined
HUBUNGAN KONSEP DIRI DAN MINAT BELAJAR DENGAN HASIL BELAJAR TIK SISWA SMA NEGERI 2 BEO DI NIAMPAK KABUPATEN KEPULAUAN TALAUD,Undefined
HUBUNGAN KONSEP DIRI DAN MOTIVASI DENGAN HASIL BELAJAR PEMROGRAMAN WEB SISWA KELAS X SMK N 1 RATAHAN,RPL
HUBUNGAN KREATIFITAS DAN GAYA BELAJAR DASAR-DASAR TEKNIK KOMPUTER DAN JARINGAN SISWA SMK KELAS X COKROAMINOTO KOTAMOBAGU,TKJ
HUBUNGAN KREATIVITAS BELAJAR DAN MOTIVASI BERPRESTASI DENGAN HASIL BELAJAR KKPI SISWA SMK NUSANTARA TONDANO,TKJ
HUBUNGAN KREATIVITAS DAN FASILITAS DENGAN PRESTASI BELAJAR SISWA DESAIN KOMUNKASI VISUAL SMK NEGERI 3 TONDANO,Multimedia
HUBUNGAN KREATIVITAS DAN MOTIVASI BELAJAR DENGAN HASIL BELAJAR TIK SISWA SMA Kr. 19 DAMAI RERER,Undefined
HUBUNGAN KREATIVITAS DAN MOTIVASI DENGAN HASIL BELAJAR KKPI SISWA SMK ANUGRAH,TKJ
HUBUNGAN KREATIVITAS DAN MOTIVASI DENGAN HASIL BELAJAR KKPI SISWA SMK NEGERI TOMPASO BARU,TKJ
HUBUNGAN KREATIVITAS DAN MOTIVASI TERHADAP HASIL BELAJAR DASAR BIDANG KEAHLIAN SIMULASI DIGITAL,Multimedia
HUBUNGAN KREATIVITAS DENGAN PRESTASI BELAJAR BIDANG KEAHLIAN MULTIMEDIA SISWA SMK NEGERI 1 TONDANO,Multimedia
HUBUNGAN MINAT BELAJAR DENGAN PRESTASI BELAJAR SIMULASI DIGITAL SISWA X SMK NEGERI 2 TONDANO,Multimedia
Hubungan Minat Dan Keaktifan Dengan Hasil Belajar KKPI SMK Negeri 1 Tondano,TKJ
HUBUNGAN MINAT DAN KEAKTIFAN DENGAN PRESTASI BELAJAR TKJ SISWA SMK NEGERI 1 RATAHAN,TKJ
HUBUNGAN MINAT DAN KREATIFITAS DENGAN PRESTASI BELAJAR KOMPETENSI KEAHLIAN SISWA KELAS XI TKJ SMK NEGERI 3 TAHUNA,TKJ
HUBUNGAN MINAT DAN KREATIVITAS DENGAN PRESTASI BELAJAR KOMPETENSI KEAHLIAN TKJ SMK NEGERI 1 TONDANO,TKJ
Hubungan minat dan motivasi dengan hasil belajar perakitan komputer siswa SMK Negeri 1 Amurang,TKJ
HUBUNGAN MINAT DAN MOTIVASI DENGAN HASIL BELAJAR TKJ SISWA SMK NEGERI 1 KAKAS,TKJ
HUBUNGAN MINAT DENGAN HASIL BELAJAR KKPI SISWA SMK,TKJ
HUBUNGAN MOTIVASI BELAJAR DAN KREATIFITAS BELAJAR DENGAN HASIL BELAJAR TIK SISWA SMA TINARANGEN NIAMPAK,Undefined
HUBUNGAN MOTIVASI BERPRESTASI DAN PERCAYA DIRI DENGAN HASIL BELAJAR KKPI SISWA KELAS X SMK NUSANTARA TONDANO,TKJ
HUBUNGAN MOTIVASI DAN FASILITAS DENGAN HASIL BELAJAR TIK SISWA SMP NEGERI 1 MOTONGKAD,Undefined
HUBUNGAN MOTIVASI DAN PERCAYA DIRI DENGAN HASIL BELAJAR SISWA KELAS XII SMA NEGERI 1 KAWANGKOAN,Undefined
Hubungan Motivasi Dengan Hasil Belajar Simulasi dan Komunikasi Digital Siswa Kelas X SMK Negeri 1 Tareran,Multimedia
HUBUNGAN MOTIVASI DENGAN PRESTASI BELAJAR SISWA KELAS X SMK NEGERI 1 RATAHAN,Undefined
HUBUNGAN MOTIVASI ORANG TUA DAN MINAT DENGAN HASIL BELAJAR JARINGAN DASAR SISWA SMK NEGERI 1 BITUNG,TKJ
HUBUNGAN PARTISIPASI DAN MINAT DENGAN HASIL BELAJAR KKPI SISWA SMK NEGERI 1 TONDANO,TKJ
HUBUNGAN PEMANFAATAN WEB PEMBELAJARAN DENGAN HASIL BELAJAR TIK SISWA SMA NEGERI 1 TOULUAAN,RPL
HUBUNGAN PEMBELAJARAN BERBASIS WEB DAN KREATIVITAS DENGAN PRESTASI BELAJAR SISWA SMK NUSANTARA TONDANO,RPL
HUBUNGAN PEMBELAJARAN WEB DAN MOTIVASI BERPRESTASI DENGAN HASIL BELAJAR TIK SISWA SMA NEGERI 1 WORI,RPL
HUBUNGAN PENGGUNAAN MEDIA PEMBELAJARAN DAN MINAT BELAJAR DENGAN HASIL BELAJAR SISWA SMK KRISTEN KAWANGKOAN,Undefined
HUBUNGAN PENGGUNAAN MEDIA SOSIAL DENGAN HASIL BELAJAR SISWA DI SMK NEGERI 1 TONDANO,Undefined
HUBUNGAN PENGGUNAAN WEB PEMBELAJARAN DAN MOTIVASI DENGAN PRESTASI BELAJAR KOMPETENSI KEAHLIAN TKJ SISWA SMK NEGERI 1 TOMOHON,TKJ
HUBUNGAN PERAN ORANG TUA DAN MINAT DENGAN HASIL BELAJAR SIMULASI DIGITAL SISWA X SMK NEGERI 1 BITUNG,Multimedia
HUBUNGAN PERHATIAN ORANG TUA DAN KEMANDIRIAN BELAJAR DENGAN HASIL BELAJAR TIK SISWA SMP NEGERI 3 PINELENG,Undefined
HUBUNGAN PERHATIAN ORANG TUA DAN MINAT DENGAN HASIL BELAJAR SISTEM KOMPUTER SISWA TKJ SMK NEGERI 1 BITUNG,TKJ
HUBUNGAN PERHATIAN ORANG TUA DAN MINAT DENGAN HASIL BELAJAR SISWA BIDANG KEAHLIAN MULTIMEDIA SMK NEGERI 1 TONDANO,Multimedia
HUBUNGAN PERSEPI SISWA TENTANG KOMPETENSI SOSIAL GURU DAN MOTIVASI BELAJAR DENGAN PRESTASI BELAJAR SISWA JURUSAN TEKNIK KOMPUTER DAN JARINGAN SMK NEGERI 1 TOMOHON,TKJ
HUBUNGAN PERSEPSI SISWA TENTANG KOMPETENSI PEDAGOGIK GURU DENGAN HASIL BELAJAR SISTEM OPERASI DASAR SISWA SMK NEGERI 1 LANGOWAN,TKJ
HUBUNGAN PERSEPSI SISWA TENTANG KOMPETENSI PROFESIONALISME GURU DAN MOTIVASI DENGAN PRESTASI BELAJAR JARINGAN DASAR SISWA SMK YADIKA LANGOWAN,TKJ
HUBUNGAN PERSEPSI SISWA TERHADAP KOMPETENSI PROFESIONAL GURU DAN MOTIVASI DENGAN PRESTASI BELAJAR SISWA PADA MATA PELAJARAN JARINGAN KOMPUTER DIKELAS XI N 1 AMURANG,TKJ
HUBUNGAN PERSEPSI TENTANG KETERAMPILAN MENGAJAR GURU DAN DISIPLIN DENGAN PRESTASI BELAJAR SISWA KELOMPOK KEAHLIAN MULTIMEDIA DI SMK NEGERI 1 TONDANO,Multimedia
HUBUNGAN SIKAP SISWA DENGAN HASIL BELAJAR SIMULASI DIGITAL DI SMK NEGERI 2 BITUNG,Multimedia
HUBUNGAN STATUS EKONOMI KELUARGA DAN MOTIVASI DENGAN HASIL BELAJAR TIK SISWA SMK NEGERI 1 TAGULANDANG UTARA,Undefined
IMPLEMENTASI TEKNIK LOW LIGHT MENGGUNAKAN DLSR UNTUK MENGHASILKAN BEST PRAKTICE FOTOGRAFI OUTDOOR,Multimedia
IMPLEMENTASI TEKNIK LOW LIGHT MENGGUNAKAN SMARTPHONE BERBASIS IOS UNTUK MENGHASILKAN BEST PRACTICE FOTOGRAFI INDOOR,Multimedia
IMPLEMENTASI TEKNIK LOW LIGHT MENGGUNAKAN SMARTPHONE UNTUK MENGHASILKAN BEST PRACTICE FOTOGRAFI OUTDOOR,Multimedia
Implementasin Aplikasi Media Pembelajaran Berbasi Android pada Mata Pelajaran Animasi 2D dan 3D di SMK,Multimedia
KESIAPAN SEKOLAH DALAM PENERAPAN E-LEARNING DI SMK,Undefined
MAWELAR MAPELA TUMAAP SUMISIR SEBUAH FILM DOKUMENTER KELURAHAN KINALI,Multimedia
MEDIA PEMBELAJARAN IPA BERBASIS MOBILE BAGI SISWA SEKOLAH DASAR,Multimedia
MEDIA PEMBELAJARAN IPS BERBASIS MOBILE DI SD GMIM URONGO,Multimedia
MEDIA PEMBELAJARAN PENGENALAN BAHASA SANGIHE UNTUK ANAK SEKOLAH DASAR BERBASIS MOBILE,Multimedia
MEDIA PEMBELAJARAN PRAKTIKUM JARINGAN KOMPUTER DI JURUSAN PTIK UNIVERSITAS NEGERI MANADO,Multimedia
MODEL PEMBELAJARAN BERBASIS MASALAH UNTUK MENINGKATKAN HASIL BELAJAR PEMROGRAMAN DASAR SISWA KELAS X TKJ DI SMK NEGERI 3 TONDANO,RPL
Model Pembelajaran Berbasis Proyek Dengan Pendekatan Computational Thinking Untuk Meningkatkan Hasil Belajar Informatika Di SMA ,RPL
MODEL PEMBELAJARAN BLENDED LEARNING UNTUK MENINGKATKAN HASIL BELAJAR FOTOGRAFI SISWA JURUSAN DESAIN KOMUNIKASI VISIUAL DI SMK,Multimedia
MODEL PEMBELAJARAN QUANTUM TERHADAP HASIL BELAJAR TIK SISWA SMA KRISTEN SONDER,Undefined
MODEL PEMBELAJARAN TUTORIAL UNTUK MENINGKATKAN HASIL BELAJAR PEMROGRAMAN DASAR SISWA SMK,RPL
PEMANFAATAN VIDEO PEMBELAJARAN UNTUK MENINGKATKAN HASIL BELAJAR KKPI SISWA KELAS XI SMK NEGERI 1 SONDER,TKJ
PEMBELAJARAN PROBLEM POSING UNTUK MENINGKATKAN HASIL BELAJAR TIK DI KELAS VII SMP NEGERI 3 TATAARAN,Undefined
PEMBUATAN WEBSITE LOKASI RAWAN BENCANA ALAM DI PULAU LEMBEH,RPL
Penerapan E-learning Untuk Meningkatkan Hasil belajar Simulasi Dan Komunikasi Digital Siswa Kelas X TKJ Di SMK Negeri 1 Tomohon,TKJ
PENERAPAN M0DEL PEMBELAJARAN KOOPERATIF TIPE JIGSAW UNTUK MENINGKATKAN HASIL BELAJAR SIMULASI DIGITAL SISWA KELAS X SMK NEGERI 1 MANADO,Multimedia
PENERAPAN MEDIA PEMBELAJARAN BERBASIS ANIMASI UNTUK MENINGKATKAN HASIL BELAJAR KKPI SISWA KELAS X SMK KRISTEN 2 TOMOHON,TKJ
PENERAPAN MEDIA PEMBELAJARAN BERBASIS SIMULASI UNTUK MENINGKATKAN HASIL BELAJAR JARINGAN DASAR SISWA SMK,TKJ
PENERAPAN MEDIA PEMBELAJARAN CISCO PACKET TRACER UNTUK MENINGKATKAN HASIL BELAJAR INSTALASI PERANGKAT JARINGAN SISWA KELAS XI SMK NEGERI 1 MOPUYA,TKJ
PENERAPAN MEDIA PEMBELAJARAN KAHOOT DALAM MENINGKATKAN HASIL BELAJAR FOTO DIGITAL SISWA KELAS XI DKV SMK NEGERI 3 TONDANO,Multimedia
Penerapan media pembelajaran simulasi untuk meningkatkan hasil belajar simulasi dan komunikasi digital siswa kelas X multimedia di SMK Negeri 1 Tumpaan,Multimedia
PENERAPAN MEDIA PEMBELAJARAN VIDEO TUTORIAL UNTUK MENINGKATKAN HASIL BELAJAR TIK SISWA KELAS XI IPA 1 SMA NEGERI 1 BOLAANG,Multimedia
Penerapan Media Pembelejaran Berbasis Web Untuk Meningkatkan Hasil Belajar KKPI SIswa Kelas X Keperawatan SMK Dharma Bakti 1 Tomohon,RPL
PENERAPAN METODE DEMONSTRASI UNTUK MENINGKATKAN HASIL BELAJAR DASAR DESAIN GRAFIS SISWA KELAS X MULTIMEDIA SMK NEGERI 1 TONDANO,Multimedia
PENERAPAN METODE DEMONSTRASI UNTUK MENINGKATKAN HASIL BELAJAR INSTALASI SISTEM OPERASI BERBASIS GUI SISWA KELAS XI TKJ SMK YADIKA LANGOWAN,TKJ
PENERAPAN METODE DEMONSTRASI UNTUK MENINGKATKAN HASIL BELAJAR KKPI SISWA KELAS X TKJ SMK KRISTEN IMMANUEL LAIKIT,TKJ
PENERAPAN METODE DEMONSTRASI UNTUK MENINGKATKAN HASIL BELAJAR KKPI SISWA KELAS XI SMK NUSANTARA TONDANO,TKJ
PENERAPAN METODE DEMONSTRASI UNTUK MENINGKATKAN HASIL BELAJAR PADA TEKNIK KOMPUTER DAN JARINGAN SISWA KELAS XI TKJ SMK NEGERI 1 TAGULANDANG SELATAN,TKJ
PENERAPAN METODE DEMONSTRASI UNTUK MENINGKATKAN HASIL BELAJAR PERAKITAN KOMPUTER SISWA KELAS X TKJ SMK KRISTEN IMMANUEL MINAHASA UTARA,TKJ
PENERAPAN METODE DEMONSTRASI UNTUK MENINGKATKAN HASIL BELAJAR PERAWATAN PC KELAS X TKJ SMK NEGERI 2 MANADO.,TKJ
PENERAPAN METODE DEMONSTRASI UNTUK MENINGKATKAN HASIL BELAJAR SISTEM OPERASI SISWA KELAS X TKJ SMK NEGERI 4 MANADO,TKJ
PENERAPAN METODE DEMONSTRASI UNTUK MENINGKATKAN HASIL BELAJAR TIK SISWA KELAS VII SMP ADVENT TONDANO,Undefined
PENERAPAN METODE DEMONSTRASI UNTUK MENINGKATKAN HASIL BELAJAR TIK SISWA KELAS VII SMP KRISTEN NAFIRI MANADO,Undefined
PENERAPAN METODE DEMONSTRASI UNTUK MENINGKATKAN HASIL BELAJAR TIK SISWA KELAS VIII SMP NEGERI IV TOMPASO BARU,Undefined
PENERAPAN METODE DEMONSTRASI UNTUK MENINGKATKAN HASIL BELAJAR TIK SISWA KELAS X SMA NEGERI 3 BITUNG.,Undefined
PENERAPAN METODE EKSPERIMEN UNTUK MENINGKATKAN HASIL BELAJAR TIK SISWA KELAS VIII SMK NEGERI I TONDANO,Undefined
PENERAPAN METODE EKSPERIMEN UNTUK MENINGKATKAN HASIL BELAJAR TIK SISWA KELAS XII SMA NEGERI 1 REMBOKEN,Undefined
"PENERAPAN METODE PEMBELAJARAN ""IMPROVE"" UNTUK MENINGKATKAN HASIL BELAJAR KKPI SISWA KELAS X MULTIMEDIA B SMK NEGERI 1 TONDANO",TKJ
PENERAPAN METODE PEMBELAJARAN DEMONSTRASI TERHADAP HASIL BELAJAR SISWA PADA MATERI PERAKITAN KOMPUTER KELAS X DI SMK NEGERI 1 TARERAN,TKJ
Penerapan Metode Pembelajaran Demonstrasi Untuk Meningkakan Hasil Belajar Desain Grafis Percetakan Siswa SMK,Multimedia
PENERAPAN METODE PEMBELAJARAN DEMONSTRASI UNTUK MENINGKATKAN HASIL BELAJAR ANIMASI 2D PADA SISWA SMK,Multimedia
PENERAPAN METODE PEMBELAJARAN DEMONSTRASI UNTUK MENINGKATKAN HASIL BELAJAR INSTALASI SISTEM OPERASI SISWA KELAS X SMK NEGERI 1 LUWUK,TKJ
PENERAPAN METODE PEMBELAJARAN DEMONSTRASI UNTUK MENINGKATKAN HASIL BELAJAR KKPI SISWA KELAS X SMK ANUGRAH TONDANO,TKJ
PENERAPAN METODE PEMBELAJARAN DEMONSTRASI UNTUK MENINGKATKAN HASIL BELAJAR MERAKIT PC SISWA KELAS X SMK NEGERI 1 MOPUYA,TKJ
PENERAPAN METODE PEMBELAJARAN DEMONSTRASI UNTUK MENINGKATKAN HASIL BELAJAR TIK SISWA KELAS VIII SMP BEREA TONDANO,Undefined
PENERAPAN METODE PEMBELAJARAN DEMONSTRASI UNTUK MENINGKATKAN HASIL BELAJAR TIK SISWA KELAS X SMA NEGERI 1 TENGA,Undefined
PENERAPAN METODE PEMBELAJARAN DEMONTRASI UNTUK MENINGKATKAN HASIL BELAJAR MERAKIT KOMPUTER SISWA KELAS X TKJ DI SMK N 1 RATAHAN,TKJ
PENERAPAN METODE PEMBELAJARAN DISCOVERY LEARNING UNTUK MENINGKATKAN HASIL BELAJAR DESAIN GRAFIS SISWA KELAS X TKJ SMK KRISTEN KAWANGKOAN,Multimedia
PENERAPAN METODE PEMBELAJARAN MODELING UNTUK MENINGKATKAN HASIL BELAJAR TIK SISWA KELAS IX SMP 6 PASSO,Undefined
penerapan metode pembelajaran problem solving untuk peningkatan hasil belajar pemodelan perangkat lunak siswa SMK,RPL
PENERAPAN METODE PEMBELAJARAN RECIPROCAL TEACHING UNTUK MENINGKATKAN HASIL BELAJAR KKPI SISWA KELAS X SMK BINA KARYA TOBELO,TKJ
PENERAPAN METODE PEMBELAJARAN TUTOR SEBAYA UNTUK MENINGKATKAN HASIL BELAJAR TIK SISWA KELAS XI SMA YPK 2 MARANATHA SORONG,Undefined
PENERAPAN METODE TUTOR SEBAYA UNTUK MENINGKATKAN HASIL BELAJAR TIK SISWA KELAS VII SMP EL-SHADAY MANADO,Undefined
PENERAPAN METODE TUTOR SEBAYA UNTUK MENINGKATKAN HASIL BELAJAR TIK SISWA KELAS X SMK NEGERI 2 BITUNG,Undefined
PENERAPAN MODEL BLENDED LEARNING UNTUK MENINGKATKAN HASIL BELAJAR KOMPUTER DAN JARINGAN DASAR SISWA KELAS X TKJ 2 SMK NEGERI 1 TOMOHON,TKJ
PENERAPAN MODEL COMPUTER ASSISTED INSTRUCTION UNTUK MENINGKATKAN HASIL BELAJAR KKPI SISWA KELAS XI TKJ SMK YADIKA LANGOWAN,TKJ
PENERAPAN MODEL DEMONSTRASI UNTUK MENINGKATKAN HASIL BELAJAR SIMULASI DAN KOMUNIKASI DIGITAL SISWA X TKJ 1 DI SMK NEGERI 3 TONDANO,Multimedia
PENERAPAN MODEL DEMONSTRASI UNTUK MENINGKATKAN HASIL BELAJAR TIK SISWA KELAS X SMA PGRI POIGAR,Undefined
PENERAPAN MODEL DEMONSTRASI UNTUK MENINGKATKAN HASIL PERAKITAN KOMPUTER SISWA KELAS X TKJ SMK NEGERI 1 AMURANG,TKJ
PENERAPAN MODEL DISCOVERY LEARNING UNTUK MENINGKATKAN HASIL BELAJAR KOMPUTER DAN JARINGAN DASAR SISWA KELAS X SMK NEGERI 1 MODOINDING,TKJ
PENERAPAN MODEL EXPLICIT INSTRUCTION UNTUK MENINGKATKAN HASIL BELAJAR SISTEM OPERASI SISWA KELAS XII SMK NEGERI 1 MOTOLING TIMUR,TKJ
PENERAPAN MODEL EXPLICIT INSTRUCTION UNTUK MENINGKATKAN HASIL BELAJAR TIK SISWA KELAS XII IPA SMA KRISTEN 1 TOMOHON,Undefined
PENERAPAN MODEL KONSTRUKTIVISME UNTUK MENINGKATKAN HASIL BELAJAR KKPI SISWA KELAS X SMK KRISTEN 2 TOMOHON,TKJ
PENERAPAN MODEL KOOPERATIF TIPE TEAMS GAMES TOURNAMENT (TGT) DALAM MENINGKATKAN HASIL BELAJAR TIK SISWA KELAS X SMTK BEREA TONDANO,Undefined
PENERAPAN MODEL PEMBELAJARAN BERBASIS KOMPUTER TIPE DRILLS TERHADAP HASIL BELAJAR SISWA KELAS X TEKNIK AUDIO DAN VIDEO SMK NEGERI 3 TAHUNA,Multimedia
PENERAPAN MODEL PEMBELAJARAN BERBASIS KOMPUTER UNTUK MENINGKATKAN HASIL BELAJAR SISWA KELAS X.D SMA NEGERI 1 KAWANGKOAAN ,Undefined
PENERAPAN MODEL PEMBELAJARAN BERBASIS MASALAH UNTUK MENINGKATKAN HASIL BELAJAR ADMINISTRASI INFRASTRUKTUR JARINGAN SISWA KELAS XI TKJ SMK COKROAMINOTO KOTAMOBAGU,TKJ
PENERAPAN MODEL PEMBELAJARAN BERBASIS MASALAH UNTUK MENINGKATKAN HASIL BELAJAR DESAIN KOMUNIKASI VISUAL SISWA KELAS X SMK NEGERI 1 LANGOWAN,Multimedia
PENERAPAN MODEL PEMBELAJARAN BERBASIS MASALAH UNTUK MENINGKATKAN HASIL BELAJAR INFORMATIKA SISWA KELAS X SMA NEGERI 2 TONDANO,RPL
PENERAPAN MODEL PEMBELAJARAN BERBASIS MASALAH UNTUK MENINGKATKAN HASIL BELAJAR INFORMATIKA SISWA KELAS X TKJ SMK NEGERI 5 MANADO,TKJ
PENERAPAN MODEL PEMBELAJARAN BERBASIS MASALAH UNTUK MENINGKATKAN HASIL BELAJAR JARINGAN DASAR SISWA KELAS X SMK ANUGRAH TONDANO,TKJ
Penerapan Model Pembelajaran Berbasis Masalah Untuk Meningkatkan Hasil Belajar Jaringan Dasar Siswa Kelas X TKJ SMK Dharma Bakti Tomohon,TKJ
PENERAPAN MODEL PEMBELAJARAN BERBASIS MASALAH UNTUK MENINGKATKAN HASIL BELAJAR JARINGAN DASAR SISWA KELAS X TKJ SMK KR. YPKM MANADO,TKJ
PENERAPAN MODEL PEMBELAJARAN BERBASIS MASALAH UNTUK MENINGKATKAN HASIL BELAJAR KKPI SISWA KELAS X SMK BINA KARYA TOBELO ,TKJ
PENERAPAN MODEL PEMBELAJARAN BERBASIS MASALAH UNTUK MENINGKATKAN HASIL BELAJAR KKPI SISWA KELAS XA TKJ SMK NUSANTARA TOBELO,TKJ
penerapan model pembelajaran berbasis masalah untuk meningkatkan hasil belajar komputer dan jaringan dasar siswa kelas x Tkj SMK N 1 Kakas,TKJ
PENERAPAN MODEL PEMBELAJARAN BERBASIS MASALAH UNTUK MENINGKATKAN HASIL BELAJAR KOMPUTER DAN JARINGAN DASAR SISWA KELAS X TKJ SMK NEGERI 1 KAKAS,TKJ
Penerapan Model Pembelajaran Berbasis masalah Untuk Meningkatkan Hasil Belajar Komputer Dan Jaringan Dasar Siswa SMK Anugrah Tondano,TKJ
Penerapan Model Pembelajaran Berbasis Masalah Untuk Meningkatkan Hasil Belajar Komputer Jaringan Dasar Siswa SMK,TKJ
PENERAPAN MODEL PEMBELAJARAN BERBASIS MASALAH UNTUK MENINGKATKAN HASIL BELAJAR PEMROGRAMAN DASAR SISWA SMK,RPL
PENERAPAN MODEL PEMBELAJARAN BERBASIS MASALAH UNTUK MENINGKATKAN HASIL BELAJAR SIMULASI DAN KOMUNIKASI DIGITAL SISWA KELAS X DI SMK NEGERI 1 TONDANO,Multimedia
PENERAPAN MODEL PEMBELAJARAN BERBASIS MASALAH UNTUK MENINGKATKAN HASIL BELAJAR SIMULASI DAN KOMUNIKASI DIGITAL SISWA KELAS X SMK NEGERI 1 RATAHAN,Multimedia
PENERAPAN MODEL PEMBELAJARAN BERBASIS MASALAH UNTUK MENINGKATKAN HASIL BELAJAR SIMULASI DAN KOMUNIKASI DIGITAL SISWA SMK,Multimedia
PENERAPAN MODEL PEMBELAJARAN BERBASIS MASALAH UNTUK MENINGKATKAN HASIL BELAJAR SIMULASI DIGITAL KELAS X TKJ 1 SMK N 3 MANADO,Multimedia
PENERAPAN MODEL PEMBELAJARAN BERBASIS MASALAH UNTUK MENINGKATKAN HASIL BELAJAR SIMULASI DIGITAL SISWA KELAS X SMK NEGERI 3 TONDANO,Multimedia
PENERAPAN MODEL PEMBELAJARAN BERBASIS MASALAH UNTUK MENINGKATKAN HASIL BELAJAR SISTEM KOMPUTER KELAS X SMK NEGERI 1 MOTOLING TIMUR,RPL
PENERAPAN MODEL PEMBELAJARAN BERBASIS MASALAH UNTUK MENINGKATKAN HASIL BELAJAR SISTEM KOMPUTER SISWA KELAS X TKJ A SMK NEGERI 1 AMURANG,RPL
PENERAPAN MODEL PEMBELAJARAN BERBASIS MASALAH UNTUK MENINGKATKAN HASIL BELAJAR SISTEM OPERASI SISWA KELAS X TKJ 1 DI SMK KRISTEN 1 TOMOHON,TKJ
PENERAPAN MODEL PEMBELAJARAN BERBASIS MASALAH UNTUK MENINGKATKAN HASIL BELAJAR TIK SISWA IX B SMP NEGERI 1 KUMELEMBUAI,Undefined
PENERAPAN MODEL PEMBELAJARAN BERBASIS MASALAH UNTUK MENINGKATKAN HASIL BELAJAR TIK SISWA KELAS VII-A SMP BEREA TONDANO,Undefined
PENERAPAN MODEL PEMBELAJARAN BERBASIS MASALAH UNTUK MENINGKATKAN HASIL BELAJAR TIK SISWA KELAS VIII SMP NEGERI 1 SONDER,Undefined
PENERAPAN MODEL PEMBELAJARAN BERBASIS MASALAH UNTUK MENINGKATKAN HASIL BELAJAR TIK SISWA KELAS VIII SMP NEGERI 2 TOULUAAN SELATAN,RPL
PENERAPAN MODEL PEMBELAJARAN BERBASIS MASALAH UNTUK MENINGKATKAN HASIL BELAJAR TIK SISWA KELAS X SMA NEGERI 1 REMBOKEN,Undefined
Penerapan Model Pembelajaran Berbasis Masalah Untuk Meningkatkan Hasil Belajar TIK Siswa Kelas X SMA Negeri 1 Tenga,Undefined
PENERAPAN MODEL PEMBELAJARAN BERBASIS MASALAH UNTUK MENINGKATKAN HASIL BELAJAR TIK SISWA X SMK KRISTEN TOMOHON,Undefined
PENERAPAN MODEL PEMBELAJARAN BERBASIS MASALAH UNTUK MENINGKATKAN HASIL TIK SISWA KELAS X SAM KRISTEN 19 DAMAI RERER,Undefined
PENERAPAN MODEL PEMBELAJARAN BERBASIS PROJEK UNTUK MENINGKATKAN HASIL BELAJAR KKPI SISWA KELAS X MULTIMEDIA SMK NEGERI 3 TONDANO,Multimedia
